{
  "created_at": "2026-05-01T00:00:00Z",
  "decision_history": [
    {
      "actor": "fixture",
      "at": "2026-05-07T00:00:00Z",
      "from_status": "candidate",
      "reason": "waiting on source readiness",
      "to_status": "park"
    }
  ],
  "id": "IDEA-8602",
  "kill_reason": "Reject if source readiness cannot be resolved.",
  "main_risks": [
    "blocked source"
  ],
  "minimum_viable_test": "Check source readiness.",
  "question": "Should this parked fixture be revisited later?",
  "recommended_next_task": "data_readiness",
  "required_data": [
    "fixture source"
  ],
  "revisit_condition": "Revisit after fixture source readiness changes.",
  "schema_version": "1.0",
  "score": {
    "budget_mode": "normal",
    "budget_mode_reason": "fixture",
    "budget_pressure_threshold": 0.8,
    "budget_usage": {
      "monthly_budget_usd": null,
      "monthly_cost_usd": 0.0,
      "monthly_usage_ratio": null,
      "weekly_budget_usd": null,
      "weekly_cost_usd": 0.0,
      "weekly_usage_ratio": null
    },
    "cost": 2,
    "data_availability": 3,
    "decision_impact": 3,
    "feasibility": 3,
    "hard_gate_results": [
      {
        "gate": "data_readiness",
        "passed": false,
        "reason": "fixture source is parked"
      }
    ],
    "killability": 3,
    "max_promotions_per_week": 3,
    "minimum_killability": 3,
    "mission_policy_version": "fixture_policy_v1.0",
    "novelty": 3,
    "promotion_threshold": 14.0,
    "reuse_potential": 3,
    "robustness_risk": 3,
    "score_explanation": "Fixture parked score.",
    "weighted_total": 10.0
  },
  "status": "park",
  "title": "Parked traceability fixture",
  "updated_at": "2026-05-07T00:00:00Z",
  "why_it_might_matter": "It verifies parked idea age."
}
